[
  {
    "king": "Lý Nhân Tông",
    "graduatedYear": "1075",
    "id": "levanthinh",
    "name": "Lê Văn Thịnh",
    "otherName": "Không rõ",
    "bornYear": 0,
    "deathYear": 0,
    "parents": [],
    "dynasties": [
      "Nhà Tiền Lý - Nhà Triệu",
      "Nhà Lý"
    ],
    "home": "Bắc Ninh",
    "desc": "Lê Văn Thịnh (chữ Hán: 黎文盛, 11-2-1050 - ?1 ), là người đỗ đầu trong khoa thi đầu tiên của Nho học Việt Nam, được bổ làm quan, dần trải đến chức Thái sư triều Lý. Năm 1084, ông thành công trong việc bàn nghị về việc cương giới với quan nhà Tống, khiến nước này phải trả lại 6 huyện 3 động 2 thuộc châu Quảng Nguyên, cho Đại Việt (nay là Việt Nam). Tuy nhiên đến năm 1096 thì ông bị đày rồi mất, sau khi xảy ra \"Vụ án hồ Dâm Đàm\" (1095).   Lê Văn Thịnh là người làng Đông Cứu, nay là thôn Bảo Tháp, huyện Gia Bình, tỉnh Bắc Ninh. Tháng 2 năm Ất Mão (1075), vua Lý Nhân Tông cho mở khoa thi Minh kinh bác học và thi Nho học tam trường 3 , Lê Văn Thịnh dự thi và đã đỗ đầu 4 . Ban đầu, ông được vào hầu vua học5 , sau trải thăng chức Nội cấp sự, rồi Thị lang bộ binh vào năm Bính Thìn (1076)6 . "
  },
  {
    "king": "Lý Nhân Tông",
    "graduatedYear": "1086",
    "id": "machientich",
    "name": "Mạc Hiển Tích",
    "otherName": "Không rõ",
    "bornYear": 1060,
    "deathYear": 0,
    "parents": [],
    "dynasties": [
      "Nhà Lý"
    ],
    "home": "Hải Dương",
    "desc": "Mạc Hiển Tích (chữ Hán: 莫顯績, 1060 -?), là người đỗ đầu tại khoa thi năm Quảng Hựu thứ 2 (Bính Dần, 1086) thời vua Lý Nhân Tông1 2 . Quê ông ở làng Lũng Động, huyện Chí Linh2 (nay thuộc xã Nam Tân, huyện Nam Sách, tỉnh Hải Dương). Sau khi thi đỗ, ông được bổ làm Hàn lâm học sĩ1 2 rồi thăng lên đến Thượng thư3 . Trạng nguyên Mạc Đĩnh Chi là cháu 5 đời của ông3 . Đại Việt sử lược chép rằng: Năm Kỷ Dậu (năm 1189- ND) là năm Thiên Tư Gia Thụy thứ 4...Nhà vua sai thái phó là Ngô Lý Tín, đô quan lang trung là Lê Năng Trường xét xử về cái vụ tranh tụng quan Thiếu sư là Mạc Hiển Tích. Bọn Lê Năng Trường sợ Mạc Hiển Tích nên không dám tìm tòi tra xét. Người trong nước cười giễu rằng: Ngô phụ quốc là Lan, Lê đô quan là Kích. Xét xử một vụ kiện tụng Mạc Hiển Tích mà chỉ bàn loanh quanh rồi thôi. Lúc bấy giờ vua thì còn nhỏ tuổi, Mạc Hiển Tích lại tư thông với bà Thái hậu. Cho nên đương thời bấy giờ người ta sợ Hiển Tích là như vậy. Lan, Kích là tên hai người cuồng...4 . Điều này xem ra đáng ngờ do ông đỗ thủ khoa năm 1086 theo như Đại Việt Sử ký toàn thư đã chép. Nếu ông đỗ khi khoảng 20 tuổi thì từ 1086 tới 1189 đã trên 103 năm, nghĩa là ông phải cỡ 120 tuổi, khó có thể còn cường tráng để tư thông với Thái hậu. (Nguồn: Wikipedia) "
  },
  {
    "king": "Lý Cao Tông",
    "graduatedYear": "1185",
    "id": "buiquockhai",
    "name": "Bùi Quốc Khái",
    "otherName": "Không rõ",
    "bornYear": 1141,
    "deathYear": 1234,
    "parents": [],
    "dynasties": [
      "Nhà Lý"
    ],
    "home": "Hải Dương",
    "desc": "Bùi Quốc Khái (chữ Hán: 裴國愾, 1141-1234) là người đỗ đầu khoa thi Tiến sĩ năm Trinh Phù thứ 10 (Ất Tỵ, 1185) dưới thời vua Lý Cao Tông (ở ngôi: 1176-1210), nước Đại Việt (nay là Việt Nam).   Bùi Quốc Khái sinh năm Tân Dậu (1141) tại làng Bình Lãng, phủ Thượng Hồng (nay là thôn Bình Phiên, xã Ngọc Liên, huyện Cẩm Giàng, tỉnh Hải Dương). Theo sử liệu1 thì ông là người có tài, nhưng vì chán công danh nên không xin thi cử. Mãi đến năm Trinh Phù thứ 10 (1185), khi tuổi đã 45, ông mới đi ứng thí, và đã đỗ đại khoa trong số 30 người trúng tuyển. Sách Đại Việt sử ký toàn thư chép: "
  },
  {
    "king": "Trần Thái Tông",
    "graduatedYear": "1234",
    "id": "nguyenquanquangnguyenquanquang",
    "name": "Nguyễn Quan Quang",
    "otherName": "Nguyễn Quán Quang",
    "bornYear": 1740,
    "deathYear": 1786,
    "parents": [],
    "dynasties": [
      "Nhà Trần",
      "Nhà Hậu Trần"
    ],
    "home": "Bắc Ninh",
    "desc": "Nguyễn Quan Quang (chữ Hán: 阮觀光, ?-?), có tài liệu ghi là Nguyễn Quán Quang hay Trần Quán Quang,1 là một danh thần thời nhà Trần. Ông được biết nhiều với giai thoại đỗ Tam nguyên và sứ giả Đại Việt đối đáp với tướng Mông Cổ. Theo văn bia số 1 tại Văn miếu Bắc Ninh, thì ông là người đỗ Trạng nguyên khoa thi Bính Ngọ 1246, tức năm Thiên Ứng Chính Bình thứ 15 đời vua Trần Thái Tông.2   Trong 2 bộ cổ sử chính thống quan trọng nhất của Việt Nam là Đại Việt Sử ký Toàn thư và Khâm định Việt sử Thông giám Cương mục đều không có ghi chép thông tin gì về Nguyễn Quan Quang. Thông tin ít ỏi về thân thế và khoa cử của ông trích từ sách Đỉnh khiết Đại Việt lịch triều đăng khoa lục được biên soạn dưới triều Lê Hiển Tông (1740-1786). Thông tin này cũng được ghi nhận trên văn bia số 1 tại Văn miếu Bắc Ninh. Theo đó, Nguyễn Quan Quang là người xã Tam Sơn, huyện Đông Ngàn (thời Trần thuộc châu Vũ Ninh, lộ Bắc Giang; nay thuộc huyện Từ Sơn, tỉnh Bắc Ninh). Ông thi đỗ Trạng nguyên khoa thi Bính Ngọ 1246, tức năm Thiên Ứng Chính Bình thứ 15 đời vua Trần Thái Tông, làm quan đến chức Bộc xạ, tặng hàm Đại Tư không2 . Những thông tin còn lại về hành trạng của ông chỉ còn lưu lại trong các giai thoại dân gian. Theo sách \"Văn hiến Kinh Bắc\"3 thì Nguyễn Quan Quang sinh trong một gia đình nghèo, không có tiền gạo theo học. Lúc nhỏ, ông thường lân la ngoài cửa lớp lúc thầy dạy học trò trong làng, rồi dùng gạch non viết chữ xuống nền sân. Sau được thầy học phát hiện tài năng và cho vào học, ông càng nổi tiếng thông minh, học một biết mười, nhanh chóng lầu thông kinh sử, ứng khẩu thành thơ, thông thái uyên thâm. Gặp khoa thi Hương, ông ứng thi đậu Giải nguyên. Đến thi Hội lại đậu Hội nguyên, khi vua Trần Thái Tông mở khoa thi Đại tị thủ sĩ, ông đậu Trạng nguyên. Vì vậy người đời đều gọi ông là \"ông Tam nguyên\". "
  },
  {
    "king": "Trần Thái Tông",
    "graduatedYear": "1247",
    "id": "nguyenhien",
    "name": "Nguyễn Hiền",
    "otherName": "Không rõ",
    "bornYear": 1234,
    "deathYear": 1256,
    "parents": [],
    "dynasties": [
      "Nhà Trần",
      "Thời kì Pháp đô hộ ",
      "Nước Việt Nam mới "
    ],
    "home": "Nam Định",
    "desc": "Nguyễn Hiền (chữ Hán: 阮賢, 1234 - 1255/1256) đỗ trạng nguyên khi 13 tuổi. Ông là người làng Dương A, huyện Thượng Hiền, phủ Thiên Trường1 (nay là xã Nam Thắng, huyện Nam Trực, tỉnh Nam Định). Ông thi đỗ trạng nguyên khi mới 13 tuổi, trở thành trạng nguyên trẻ nhất trong lịch sử khoa cử Việt Nam, tại khoa thi tháng 2 năm Thiên Ứng Chính Bình thứ 16 (1247) thời vua Trần Thái Tông. Cùng năm đó có Lê Văn Hưu (黎文休) 17 tuổi đỗ Bảng nhãn và Đặng Ma La (鄧麻羅) 14 tuổi đỗ Thám hoa. Đây cũng là khoa thi đầu tiên trong lịch sử đặt ra danh vị Tam khôi, bao gồm trạng nguyên, bảng nhãn, thám hoa. Vì còn thiếu niên nên vua cho ông về quê 3 năm tu dưỡng, sau ra làm quan đến chức Thượng thư bộ Công. Về hưu, mất tại nhà. Có đi sứ nhà Nguyên vài lần.   Nguyễn Hiền mồ côi cha từ nhỏ, bà mẹ đã cho ông theo học sư cụ chùa Hà Dương ở làng Dương A. Tương truyền, lúc đầu vào học sư mới viết được 10 trang giấy, Hiền liền đọc ngay được như người đã từng đi học rồi, sư cụ lấy làm lạ. Một đêm, sư cụ nằm mộng thấy Phật quở rằng: \"Trạng nguyên mỗi lần vào chùa thường nghịch ngợm, sao nhà ngươi không răn đe, ngăn chặn?\". Sư tỉnh dậy, đốt đuốc khắp chùa thấy sau lưng các pho tượng đều có khắc chữ \"phạt 30 roi\", riêng hai pho hộ pháp ghi \"phạt 60 roi\", sư nhận ra ngay chữ của Hiền. Một hôm, sư lên lớp bèn lấy một câu trong sách: \"Kính quỷ thần mà phải lánh xa\" mà dặn Hiền rằng: \"Phật tức quỷ thần, trò không được nhạo báng\". Hiền liền nhận lỗi và tự lau sạch những chữ mình đã viết. Từ đó, Hiền càng chăm chỉ học tập, học đến đâu nhớ đến đấy, xuất khẩu thành chương. Năm 11 tuổi, Hiền đã nổi tiếng và được mệnh danh là \"thần đồng\". Bấy giờ có người họ Đặng tự cho mình là đã đọc biết hết các sách, nghe tiếng tăm Hiền liền tìm đến nhà Hiền thử tài, ra đầu đề bài phú: "
  },
  {
    "king": "Trần Thái Tông",
    "graduatedYear": "1256",
    "id": "tranquoclac",
    "name": "Trần Quốc Lặc",
    "otherName": "Không rõ",
    "bornYear": 0,
    "deathYear": 0,
    "parents": [],
    "dynasties": [],
    "home": "Hải Dương",
    "desc": "Trần Quốc Lặc (chữ Hán: 陳國扐, ? - ?) là Trạng nguyên của Việt Nam, ông là người làng Uông Hạ, huyện Thanh Lâm, châu Thượng Hồng1 2 (nay là thôn Uông Hạ, xã Minh Tân, huyện Nam Sách, tỉnh Hải Dương). Tháng 2 năm 1256, ông đỗ Kinh trạng nguyên khoa Bính Thìn niên hiệu Nguyên Phong thứ 6, đời Trần Thái Tông, cùng khoa với Trại trạng nguyên Trương Xán, bảng nhãn Chu Hinh, thám hoa lang Trần Uyên3 . Làm quan đến Thượng thư. Sau khi mất, vua phong làm Phúc thần, hiệu là Mạnh Đạo Đại Vương1 . (Nguồn: Wikipedia) "
  },
  {
    "king": "Trần Thánh Tông",
    "graduatedYear": "1266",
    "id": "tranco",
    "name": "Trần Cố",
    "otherName": "Không rõ",
    "bornYear": 1731,
    "deathYear": 1787,
    "parents": [],
    "dynasties": [
      "Trịnh Nguyễn Phân Tranh",
      "Nhà Nguyễn"
    ],
    "home": "Hải Dương",
    "desc": "Trần Cố (chữ Hán: 陳固, ? - ?), người xã Phạm Triền, huyện Thanh Miện, phủ Hạ Hồng1 (nay là thôn Phạm Lý, xã Ngô Quyền, huyện Thanh Miện, tỉnh Hải Dương), đỗ Kinh trạng nguyên khoa Bính Dần, năm Thiệu Long thứ 9 (1266), đời Trần Thánh Tông2 , cùng khoa với Trại trạng nguyên Bạch Liêu. Ông làm quan đến chức Hiến sát sứ1 . (Nguồn: Wikipedia) "
  },
  {
    "king": "Trần Thánh Tông",
    "graduatedYear": "1272",
    "id": "lydaotai",
    "name": "Lý Đạo Tái",
    "otherName": "Không rõ",
    "bornYear": 1254,
    "deathYear": 1334,
    "parents": [],
    "dynasties": [
      "Nhà Trần"
    ],
    "home": "Bắc Ninh",
    "desc": "Sơ khai Thiền phái Tì-ni-đa-lưu-chi Thiền phái Vô Ngôn Thông Thiền phái Thảo Đường Thiền phái Trúc Lâm Huyền Quang (玄光), 1254-1334, tên thật là Lý Đạo Tái (李道載), người hương Vạn Tải, châu Nam Sách, lộ Lạng Giang. Nay là làng Vạn Tải, xã Thái Bảo, huyện Gia Bình, tỉnh Bắc Ninh. Học giỏi, đỗ cả thi hương, thi hội. Ông đỗ đệ nhất giáp tiến sĩ (trạng nguyên) khoa thi năm 1272?[1] hay 1274?[2] và được bổ làm việc trong Viện Nội Hàn của triều đình, tiếp sư Bắc triều, nổi tiếng văn thơ. Sau này từ chức đi tu, theo Trần Nhân Tông lên Trúc Lâm. Là một Thiền sư Việt Nam, tổ thứ ba dòng Trúc Lâm Yên Tử. Ông là một nhà thơ lớn với nhiều bài thơ còn được lưu lại. Cùng với Trúc Lâm Đầu Đà Trần Nhân Tông và Pháp Loa, ông được xem là một Đại thiền sư của Việt Nam và người ta xem ông và hai vị nêu trên ngang hàng với sáu vị tổ của Thiền tông Trung Quốc hoặc 28 vị tổ của Thiền Ấn Độ. "
  },
  {
    "king": "Trần Anh Tông",
    "graduatedYear": "1304",
    "id": "macdinhchitietphu",
    "name": "Mạc Đĩnh Chi",
    "otherName": "Tiết Phu",
    "bornYear": 1280,
    "deathYear": 1346,
    "parents": [],
    "dynasties": [
      "Nhà Trần",
      "Nhà Hậu Trần"
    ],
    "home": "Hải Dương",
    "desc": "Mạc Đĩnh Chi (chữ Hán: 莫挺之, 1280 - 1346), tên tự là Tiết Phu (節夫), hiệu là Tích Am (僻庵) là một quan đại thần triều Trần trong lịch sử Việt Nam3 .   Theo Đại Việt sử ký toàn thư, Mạc Đĩnh Chi quê ở xứ làng Bàng Hà4 và Ba Điểm. Trong cuộc kháng chiến chống quân Nguyên năm 1287 đã theo hàng quân Nguyên. Nhà Trần sau chiến thắng đã trị tội cả làng, bắt dân làm lính hầu cho các vương hầu nhà Trần, không cho làm quan, nhưng sau này năm 1304, Mạc Đĩnh Chi vẫn được ứng thi và làm quan.5 Theo Lịch triều hiến chương loại chí, Mạc Đĩnh Chi là người làng Lũng Động, huyện Chí Linh, Hải Đông (tỉnh Hải Dương hiện nay), tổ tiên là Mạc Hiển Tích đỗ khoa Thái học sinh năm Bính Dần đời vua Lý Nhân Tông. 6 . Ông thông minh hơn người, nhưng tướng mạo xấu xí.3 Chiêu Quốc Vương Trần Ích Tắc mở học đường, tập hợp văn sĩ bốn phương, chu cấp cho ăn mặc, đào tạo nhiều nhân tài, trong đó có Mạc Đĩnh Chi. Sách Đại Việt sử ký toàn thư chép rằng:Ích Tắc là con thứ của Thượng hoàng, thông minh hiếu học, thông hiểu lịch sử, lục nghệ, văn chương nhất đời. Dù nghề vặt như đá cầu, đánh cờ, không nghề ghì không thông thạo; từng mở học đường ở bên hữu phủ đệ, tập hợp văn sĩ bốn phương cho học tập, cấp cho ăn mặc, đào tạo thành tài như Mạc Đĩnh Chi ở Bàng Hà, Bùi Phóng ở Hồng Châu v.v... gồm 20 người, đều được dùng cho đời.7 "
  },
  {
    "king": "Lê Thái Tông",
    "graduatedYear": "1442",
    "id": "nguyentruchulieu",
    "name": "Nguyễn Trực",
    "otherName": "Hu Liêu",
    "bornYear": 1417,
    "deathYear": 1474,
    "parents": [],
    "dynasties": [
      "Nhà Hậu Lê",
      "nhà Lê Sơ"
    ],
    "home": "Hà Nội",
    "desc": "Nguyễn Trực (chữ Hán: 阮直, 1417 - 1474), hiệu là Hu Liêu, tự là Nguyễn Công Dĩnh, quê xã Bối Khê huyện Thanh Oai, thành phố Hà Nội). Ông đỗ đầu trong số đệ nhất giáp tiến sĩ cập đệ (tức trạng nguyên) năm 14421 đời vua Lê Thái Tông.   Nguyễn Trực sinh ngày 16 tháng 5 năm Đinh Dậu tức 31 tháng 5 năm 1417, trong một gia đình nho học. Ông nội là tiến sĩ Nguyễn Bính2 , giữ chức Nho học huấn đạo giáo quan Quốc Tử Giám, thời vua Trần Hiến Tông. Bố của Nguyễn Trực là tiến sĩ Nguyễn Thời Trung2 . Nguyễn Trực lên 12 tuổi đã giỏi văn. Năm 1434, Nguyễn Trực đi thi Hương và đỗ đầu. Năm Nhâm Tuất (1442), ông dự kỳ thi Đình3 và đỗ Trạng nguyên4 , trở thành trạng nguyên đầu tiên nhà Hậu Lê5 . "
  },
  {
    "king": "Lê Nhân Tông",
    "graduatedYear": "1448",
    "id": "nguyennghieutunguyenvantru",
    "name": "Nguyễn Nghiêu Tư",
    "otherName": "Nguyễn Văn Trư",
    "bornYear": 1383,
    "deathYear": 1471,
    "parents": [],
    "dynasties": [
      "Nhà Tiền Lê",
      "Nhà Hậu Lê",
      "nhà Lê Sơ",
      "nhà Lê Trung Hưng"
    ],
    "home": "Bắc Ninh",
    "desc": "Nguyễn Nghiêu Tư (tiếng Trung: 阮堯咨, 1383 - 1471), bản danh Nguyễn Văn Trư (阮文豬)1 , tự Quân Trù (君廚), hiệu Tùng Khê (松溪), người huyện Vũ Ninh, phủ Từ Sơn2 3 . Một tài liệu của Viện Hán-Nôm lại cho hay, ông là người xã Phù Lương, huyện Võ Giàng, phủ Từ Sơn, xứ Kinh Bắc (nay thuộc huyện Quế Võ, tỉnh Bắc Ninh)3 . Ông là một trạng nguyên thời nhà Lê sơ2 , làm quan đến chức Thượng thư3 . Ông sinh năm Qúy Hợi (1383) đỗ Trạng nguyên khoa Mậu Thìn niên hiệu Thái Hòa thứ 6 (1448), đời Lê Nhân Tông khi 65 tuổi, làm quan Hàn lâm trực học sĩ, An phủ sứ lộ Tân Hưng Thượng2 . Đầu năm Thiên Hưng thứ nhất (tháng 10 âm lịch năm 1459) thời Lê Nghi Dân, ông được cử cùng Lê Cảnh Huy, Nguyễn Như Đổ, Hoàng Thanh sang nhà Minh nộp cống hằng năm và xin bỏ việc mò ngọc trai2 . Tài liệu của Viện Hán-Nôm lại cho ông được cử làm Phó sứ (năm 1460) sang Đại Minh cầu phong3 trong khi Đại Việt sử ký toàn thư nói rằng ... Ngày 20, lại sai bọn Trần Phong, Lương Như Hộc, Trần Bá Linh sang nhà Minh cầu phong...2 . Sau đó, ông được thăng lên Lại bộ thượng thư (chưởng lục bộ)3 . Toàn thư có đôi dòng sau: (Nguồn: Wikipedia) "
  },
  {
    "king": "Lê Thánh Tông",
    "graduatedYear": "1472",
    "id": "vukiettri",
    "name": "Vũ Kiệt",
    "otherName": "Tri",
    "bornYear": 1452,
    "deathYear": 0,
    "parents": [],
    "dynasties": [],
    "home": "Bắc Ninh",
    "desc": "Vũ Kiệt (chữ Hán: 武傑,1452 - ?), người xã Yên Việt, huyện Siêu Loại, Kinh Bắc1 2 (nay là thôn Cửu Yên thuộc xã Ngũ Thái, huyện Thuận Thành tỉnh Bắc Ninh), đỗ đầu đệ nhất giáp tiến sĩ cập đệ (Trạng nguyên) khoa tháng tư, Nhâm Thìn, Hồng Đức năm thứ 3 (1472), đời Lê Thánh Tông3 cùng Nguyễn Toàn An, Vương Khắc Thuật đỗ đệ nhất giáp tiến sĩ cập đệ; bọn Vũ Đức Khang 7 người đỗ đệ nhị giáp tiến sĩ xuất thân; bọn Chử Phong 16 người đỗ đệ tam giáp đồng tiến sĩ xuất thân. Do ngôi làng quê ông có tên Nôm là làng Vít nên dân gian quen gọi Vũ Kiệt là Trạng Vít (Trạng làng Vít)4 . Khoa thi này cũng là khoa đầu tiên định lệ tư cánh của tiến sĩ: Nếu vào Hàn lâm viện thì được gia 1 cấp; nếu bổ làm Giám sát ngự sử hay Tri huyện thì giữ nguyên phẩm cũ mà bổ3 . Vũ Kiệt làm quan tới Hàn lâm viện thị thư3 , Tả thị lang kiêm Đông các hiệu thư2 . (Nguồn: Wikipedia) "
  },
  {
    "king": "Lê Thánh Tông",
    "graduatedYear": "1475",
    "id": "vutuanchieu",
    "name": "Vũ Tuấn Chiêu",
    "otherName": "Không rõ",
    "bornYear": 1426,
    "deathYear": 0,
    "parents": [],
    "dynasties": [],
    "home": "Nam Định",
    "desc": "Vũ Tuấn Chiêu (chữ Hán: 武濬昭, 1426 - ?) nguyên quán xã Cổ Liễu, huyện Tây Chân (nay thuộc xã Nam Hùng huyện Nam Trực, tỉnh Nam Định), phủ Phụng Thiên, trú quán phường Nhật Chiêu, huyện Quảng Đức (nay thuộc xã Đông Ngạc, huyện Từ Liêm, thành phố Hà Nội)1 . Ông đỗ đầu trong số ba đệ nhất giáp tiến sĩ cập đệ (tức trạng nguyên) khoa thi Hồng Đức năm thứ 6 (1475)2 . Ông làm quan đến Tả Thị lang Bộ Lại1 . (Nguồn: Wikipedia) "
  },
  {
    "king": "Lê Thánh Tông",
    "graduatedYear": "1481",
    "id": "phamdonlelukhanh",
    "name": "Phạm Đôn Lễ",
    "otherName": "Lư Khanh",
    "bornYear": 1457,
    "deathYear": 0,
    "parents": [],
    "dynasties": [
      "Thời kỳ thuộc Minh "
    ],
    "home": "Thái Bình",
    "desc": "Phạm Đôn Lễ (chữ Hán: 范敦禮, 1457 - ?), tự là Lư Khanh, là Trạng nguyên khoa Tân Sửu (1481), niên hiệu Hồng Đức 12, đời vua Lê Thánh Tông. Vì có công dạy dân làng dệt chiếu cói nên còn gọi là Trạng Chiếu hay Tam nguyên Đôn Lễ.1 2 . Ông làm quan đến các chức Tả thị lang, rồi Thượng Thư. Phạm Đôn Lễ quê gốc ở Tứ Kỳ Hải Dương.sinh ở làng Hải Triều (tục gọi là Làng Hới) (hiện nay vẫn dùng được cả hai cách gọi này) thuộc tổng Thanh Triều, phủ Long Hưng, huyện Ngự Thiên, tỉnh Hưng Yên (nay là thôn Hải Triều, xã Tân Lễ, huyện Hưng Hà tỉnh Thái Bình). Ông đỗ đầu cả ba kỳ: thi Hương, thi Hội và thi Đình nên gọi là Tam nguyên. Tại trường thi Đình, ông đỗ chính danh Trạng nguyên khoa Tân Sửu (1481), niên hiệu Hồng Đức 12, đời vua Lê Thánh Tông. Vì có công dạy dân làng dệt chiếu cói nên còn gọi là Trạng Chiếu hay Tam nguyên Đôn Lễ.1 2 . Ông làm quan đến các chức Tả thị lang, rồi Thượng Thư. Ông là người cùng làng với Lễ nghi học sĩ Nguyễn Thị Lộ. Ông làm quan đến các chức Tả thị lang, rồi Thượng Thư đời vua Lê Thánh Tông. Sau đó được cử đi sứ sang nhà Minh (Trung Quốc). Khi về nước, ông đã đem các kỹ thuật dệt chiếu tiên tiến mà ông học được ở Quế Lâm tỉnh Quảng Tây Trung Quốc, về truyền bá cho dân làng Hải Triều và dân các làng miền duyên hải trấn Sơn Nam Hạ. Trước đó dân miền biển thường dệt chiếu với bàn dệt không có ngựa đỡ. Với kỹ thuật dệt chiếu với bàn dệt nằm có ngựa đỡ sợi (sợi đay) học được của người Trung Quốc, ông đã giúp người dân quê hương dệt ra những loại chiếu đẹp hơn, nhanh hơn. Sợi đay được căng trên ngựa đỡ, thuận lợi cho người trao chiếu (tức là trao cói), đẩy nhanh được tốc độ dệt chiếu. Chính nhờ cải cách này nghề dệt chiếu thủ công ở vùng ven biển miền Bắc trở nên phát triển, làng Hải Triều thành làng dệt chiếu nổi tiếng. Đã từ vài chục năm nay, chiếu Hới- Hải Triều có mặt ở khắp mọi miền tổ quốc từ Bắc vào Nam. Khi từ quan, ông về ở và dạy học tại làng Mỹ Xá, xã Ngọc Sơn, huyện Tứ Kỳ, tỉnh Hải Dương. Tại khu đất Đồng Cời thuộc thôn Mỹ Xá, xã Ngọc Sơn hiện nay có lăng mộ thờ Trạng nguyên Phạm Đôn Lễ.3 Con trai Phạm Đôn Lễ là Phạm Nguyên Chấn cũng đỗ Hoàng giáp tiến sĩ ở triều nhà Lê sơ. "
  },
  {
    "king": "Lê Thánh Tông",
    "graduatedYear": "1484",
    "id": "nguyenquangbatnguyenquanghieu",
    "name": "Nguyễn Quang Bật",
    "otherName": "Nguyễn Quang Hiếu",
    "bornYear": 0,
    "deathYear": 0,
    "parents": [],
    "dynasties": [],
    "home": "Bắc Ninh",
    "desc": "Nguyễn Quang Bật (chữ Hán: 阮光弼; 1463–1505) tên thật Nguyễn Quang Hiếu, là người đỗ trạng nguyên năm 1484 dưới triều vua Lê Thánh Tông. Ông là người huyện Gia Bình, tỉnh Bắc Ninh, có ý chí \"nhân định thắng thiên\", không tin vào số mệnh. Tương truyền trước khoa thi ông nằm mơ thấy Thần hiện về báo mộng ông sẽ không đoạt giải cao; thế nhưng ông tin rằng \"Thần đâu biết được việc người; phen này ta đỗ, đỗ thời trạng nguyên\" và càng ra sức học. Đến kì thi Đình ông đã đoạt được ngôi vị đầu bảng, giành lấy chức vị trạng nguyên. Làm quan Hàn lâm Hiệu lý. Ông là thành viên nhóm Tao đàn Nhị thập bát Tú. Vì trái ý của Lê Uy Mục nên bị giáng xuống Thừa Tuyên, Quảng Nam. Vua sai người mật dìm chết ở sông Phúc Giang. Tương Dực Đế biết ông chết oan, bèn truy phong tước Bá, và tặng lá cờ thêu 3 chữ\" Trung Trạng nguyên\". Vua còn cho dân địa phương lập miếu thờ làm thành hoàng. (Nguồn: Wikipedia) "
  },
  {
    "king": "Lê Thánh Tông",
    "graduatedYear": "1487",
    "id": "transungdinh",
    "name": "Trần Sùng Dĩnh",
    "otherName": "Không rõ",
    "bornYear": 1514,
    "deathYear": 0,
    "parents": [],
    "dynasties": [],
    "home": "Hải Dương",
    "desc": "Trần Sùng Dĩnh (chữ Hán: 陳崇穎, 1465–?) là một Trạng nguyên của Việt Nam. Ông là người làng Đồng Khê, huyện Thanh Lâm, phủ Thượng Hồng (nay là thôn Đồng Khê, xã An Lâm, huyện Nam Sách, tỉnh Hải Dương). Ông đỗ Trạng nguyên khoa Đinh Mùi niên hiệu Hồng Đức thứ 18 (1487)1 , đời Lê Thánh Tông. Làm quan Đô ngự sử Thập nhị Kinh diên, rồi được thăng lên Hộ bộ hữu thị lang và Hộ bộ Thượng thư vào tháng 12 năm 1514 dưới thời vua Lê Tương Dực. Sau khi mất, ông được phong làm Phúc thần và được thờ phụng ở quê nhà. (Nguồn: Wikipedia) "
  },
  {
    "king": "Lê Thánh Tông",
    "graduatedYear": "1490",
    "id": "vuduevunghiachi",
    "name": "Vũ Duệ",
    "otherName": "Vũ Nghĩa Chi",
    "bornYear": 1468,
    "deathYear": 1522,
    "parents": [],
    "dynasties": [
      "Nhà Tiền Lê",
      "Nhà Hậu Lê",
      "nhà Lê Sơ",
      "nhà Lê Trung Hưng"
    ],
    "home": "Phú Thọ",
    "desc": "Vũ Duệ (chữ Hán: 武睿, 1468-1522)1 , vốn tên là Vũ Nghĩa Chi, sau vua Lê Thánh Tông cho đổi tên là Vũ Duệ2 ; là danh thần nhà Lê sơ trong lịch sử Việt Nam.   Ông là người làng Trình Xá (Kẻ Chịnh), huyện Sơn Vi, trấn Sơn Tây (nay thuộc làng Trình Xá, xã Vĩnh Lại, huyện Lâm Thao, tỉnh Phú Thọ). Thủa nhở ông nổi tiếng thông minh, đối đáp lưu loát, 7 tuổi đã đọc thông, viết thạo và đã biết làm thơ, người đương thời thường gọi ông là\" Thất Tuế Thần Đồng\". Khoa Canh Tuất, niên hiệu Hồng Đức thứ 21 (1490) dưới thời vua Lê Thánh Tông, ông thi đỗ Trạng nguyên lúc 22 tuổi, cùng khoa với Ngô Hoán (đỗ Bảng nhãn) và Lưu Thư Ngạn (đỗ Thám hoa)3 . Đời vua Lê Hiến Tông, ông giữ chức Tản trị thừa tuyên sứ ty, tham chính xứ Hải Dương4 . Năm 1520 đời vua Lê Chiêu Tông, ông giữ chức Lại bộ Thượng thư kiêm Đông các Đại học sĩ nhập thị Kinh diên, hàm Thiếu bảo, tước Trình Khê hầụ, và được ban phong là Trinh ý công thần5 . "
  },
  {
    "king": "Lê Thánh Tông",
    "graduatedYear": "1493",
    "id": "vutichvutich",
    "name": "Vũ Tích",
    "otherName": "Vũ Tích",
    "bornYear": 0,
    "deathYear": 0,
    "parents": [],
    "dynasties": [],
    "home": "Hải Dương",
    "desc": "Vũ Dương (chữ Hán: 武暘, ? - ?), có sách chép là Vũ Tích, người làng Man Nhuế, huyện Thanh Lâm, thừa tuyên Hải Dương (nay thuộc thôn Mạn Nhuế, thị trấn Nam Sách (xã Thanh Lâm cũ), huyện Nam Sách, tỉnh Hải Dương). Đỗ Trạng nguyên khoa Quý Sửu, niên hiệu Hồng Đức thứ 24 (1493)1 . Làm quan đến Hàn lâm Thị thư, đi sứ Trung Quốc, được thăng chức thượng thư bộ Công và được phong tước Hầu. Ông có tham gia nhóm Tao đàn Nhị thập bát Tú của Lê Thánh Tông2 . (Nguồn: Wikipedia) "
  },
  {
    "king": "Lê Hiển Tông",
    "graduatedYear": "1499",
    "id": "dolykhiem",
    "name": "Đỗ Lý Khiêm",
    "otherName": "Không rõ",
    "bornYear": 0,
    "deathYear": 0,
    "parents": [],
    "dynasties": [
      "Thời kỳ thuộc Minh "
    ],
    "home": "Thái Bình",
    "desc": "Đỗ Lý Khiêm (chữ Hán: 杜履謙, ? - ?), người làng Ngoại Lãng xã Song Lãng huyện Thư Trì, phủ Kiến Xương, trấn Sơn Nam Hạ (nay là làng Ngoại Lãng xã Song Lãng là huyện Vũ Thư tỉnh Thái Bình). Đỗ trạng nguyên khoa thi Kỷ Mùi, niên hiệu Cảnh Thống thứ 2 (1499)1 , đời Lê Hiến Tông. Làm quan đến Phó đô Ngự sử. Đi sứ nhà Minh bị mất ở dọc đường. Ông là anh ruột của tiến sĩ (đệ tam giáp đồng tiến sĩ), Hội nguyên khoa Mậu Thìn (1508), đời vua Lê Uy Mục, là Đỗ Oánh (tức Đỗ Vinh2 ). (Nguồn: Wikipedia) "
  },
  {
    "king": "Lê Hiển Tông",
    "graduatedYear": "1502",
    "id": "leichmoc",
    "name": "Lê Ích Mộc",
    "otherName": "Không rõ",
    "bornYear": 1458,
    "deathYear": 1538,
    "parents": [],
    "dynasties": [
      "nhà Lê Sơ"
    ],
    "home": "Hải Phòng",
    "desc": "Lê Ích Mộc (chữ Hán: 黎益沭, 1458 - 1538), người xã Thanh Lãng, huyện Thủy Đường, phủ Kinh Môn1 2 3 (nay thuộc huyện Thủy Nguyên, thành phố Hải Phòng), đỗ đầu đệ nhất giáp tiến sĩ cập đệ (Trạng nguyên) khoa tháng hai, Nhâm Tuất, Cảnh Thống năm thứ 5 (1502), đời Lê Hiến Tông cùng Lê Sạn, Nguyễn Văn Thái đỗ đệ nhất giáp tiến sĩ cập đệ; bọn Nguyễn Cảnh Diễn, Lê Nhân Tế 24 người đỗ đệ nhị giáp tiến sĩ xuất thân; bọn Phạm Khiêm Bính, Nguyễn Mậu 34 người đỗ đệ tam giáp đồng tiến sĩ xuất thân. Ông nguyên là đạo sĩ, đến khi đỗ, vua sai tuyên đọc chế từ, bưng lư hương cháy rực lửa ra trước, bị bỏng tuột cả tay mà không biết1 . Tại khoa thi này, vua đích thân ra đầu bài văn sách hỏi về đế vương trị thiên hạ. Sai Nam Quân đô đốc phủ tả đô đốc phò mã đô uý Lâm Hoài bá Lê Đạt Chiêu, và Hộ bộ thượng thư Vũ Hữu làm đề điệu: Binh bộ tả thị lang Dương Trực Nguyên và Ngự sử đài thiêm đô ngự sử Bùi Xương Trạch làm giám thí; Lễ bộ thượng thư Tả Xuân phường hữu dụ đức kiên Đông các đại học sĩ Đàm Văn Lễ, Lễ bộ thượng thư kiêm Hàn lâm viện thị độc, trưởng Hàn lâm viện sự Nguyễn Bảo, Lễ bộ tả thị lang kiêm Đông các học sĩ Lê Ngạn Tuất, Quốc tử giám tế tửu Hà Công Trình, Tư nghiệp Hoàng Bồi, Thái thường tự khanh Nghiêm Lâm Tiến đọc quyển thi1 . Khoa thi này có một điểm mới là: Mọi năm bảng vàng vẫn treo ở ngoài cửa Đông Hoa, đến nay vua sai Lễ bộ bưng ra, đánh trống nổi nhạc rước ra treo ở cửa nhà Thái học. Bảng vàng treo ở cửa nhà Thái học bắt đầu từ đó1 . Lê Ích Mộc làm quan tới Tả thị lang3 . Khi ông chết, nhân dân địa phương lập miếu thờ và tạc tượng ông thờ ở cạnh chùạ Diên Phúc3 . (Nguồn: Wikipedia) "
  },
  {
    "king": "Lê Uy Mục",
    "graduatedYear": "1505",
    "id": "lenainamhien",
    "name": "Lê Nại",
    "otherName": "Nam Hiên",
    "bornYear": 1479,
    "deathYear": 0,
    "parents": [],
    "dynasties": [
      "nhà Lê Sơ"
    ],
    "home": "Hải Dương",
    "desc": "Lê Nại (chữ Hán: 黎鼐, 1479 - ?), hiệu Nam Hiên, người xã Mộ Trạch, huyện Đường Am, phủ Thượng Hồng (nay là huyện Bình Giang, tỉnh Hải Dương). Ông đỗ Đệ nhất giáp Tiến sĩ cập đệ Đệ nhất danh (Trạng nguyên) năm 27 tuổi, tại khoa Ất Sửu năm Đoan Khánh thứ 1 (1505) đời Lê Uy Mục1 , trong tháng 2 âm lịch năm đó cùng bảng nhãn Bùi Doãn Văn, thám hoa Trần Phỉ và 52 người khác đỗ tiến sĩ. Ông là con rể của hoàng giáp Vũ Quỳnh và cháu nội của danh thần Lê Cảnh Tuân đã tuẫn quốc dưới thời Minh thuộc. Ông có tiếng hay chữ, thi hương, thi đình đều đỗ đầu. Làm quan tới chức Hữu thị lang bộ Hộ. Sau khi mất, được triều đình truy tặng tước Đạo Trạch bá. Hoàng giáp Lê Tư là em ruột của ông. Con trai ông là Lê Quang Bí cũng là danh sĩ có tiếng, đỗ Hoàng giáp. (Nguồn: Wikipedia) "
  },
  {
    "king": "Lê Uy Mục",
    "graduatedYear": "1508",
    "id": "nguyengianthanhtrangme",
    "name": "Nguyễn Giản Thanh",
    "otherName": "Trạng Me",
    "bornYear": 1453,
    "deathYear": 0,
    "parents": [],
    "dynasties": [
      "nhà Mạc",
      "nhà Lê Sơ"
    ],
    "home": "Bắc Ninh",
    "desc": "Nguyễn Giản Thanh (chữ Hán: 阮簡清; thường được gọi là Trạng Me; 1482–1552) là trạng nguyên khoa thi Đoan Khánh năm thứ tư (1508), đời vua Lê Uy Mục1 . Ông là con của tiến sĩ Nguyễn Giản Liêm, người làng Ông Mặc (tục gọi là làng Me) huyện Đông Ngàn (nay là Từ Sơn), tỉnh Bắc Ninh. Ông làm quan đến chức Hàn lâm viện Thị thư kiêm Đông các Đại học sĩ2 . Sau đó, lại ra làm quan với nhà Mạc2 và được cử đi sứ sang nhà Minh (Trung Quốc) để cầu phong cho Mạc Đăng Dung. Khi trở về, ông được thăng Thượng thư Bộ Lễ kiêm Hàn lâm viện Thị độc, Chưởng viện sự, tước Trung Phụ bá. Khi mất được tặng tước hầu. Thân phụ của ông là tiến sĩ Nguyễn Giản Liêm2 3 (1453-?). Lúc Nguyễn Giản Thanh còn đi học, thầy học là Đàm Thuận Huy, thấy học trò sắp ra về thì trời đổ mưa to, học trò không về được, thầy bèn ra vế đối để thử tài học trò: Nguyễn Giản Thanh liền đối lại là: Thầy Đàm Thuận Huy nói: Tương truyền, Nguyễn Giản Thanh chỉ đậu bảng nhãn còn Hứa Tam Tỉnh (làng Ngọt) đậu trạng nguyên. Trong buổi lễ ra mắt vua, các tân khoa phải làm một bài phú dâng tặng vua và hoàng thái hậu (mẹ của vua). Hoàng thái hậu thấy Hứa Tam Tỉnh dung mạo xấu xí thì không ưng lắm, trong khi đó Nguyễn Giản Thanh khuôn mặt khôi ngô thanh tú nên bà muốn cân nhắc ông lên làm trạng nguyên. Vua vì muốn chiều lòng mẹ nên đánh giá bài phú của Nguyễn Giản Thanh cao hơn và trao danh hiệu trạng nguyên cho ông. Do đó dân gian có câu Trạng (làng) Me đè trạng (làng) Ngọt "
  },
  {
    "king": "Lê Tương Dực",
    "graduatedYear": "1511",
    "id": "hoangnghiaphu",
    "name": "Hoàng Nghĩa Phú",
    "otherName": "Không rõ",
    "bornYear": 1453,
    "deathYear": 1534,
    "parents": [],
    "dynasties": [
      "Trịnh Nguyễn Phân Tranh"
    ],
    "home": "Hà Nội",
    "desc": "Hoàng Nghĩa Phú (chữ Hán: 黃義富, 14791 hay 14802 - ?), người xã Mạc Xá (Danh sách trạng nguyên chép là Lương Xá), huyện Chương Đức, phủ Ứng Thiên (nay là huyện Chương Mỹ, Hà Nội) sau chuyển sang ở xã Đan Khê, huyện Thanh Oai, phủ Ứng Thiên (nay là làng Đa Sĩ, phường Kiến Hưng, quận Hà Đông, thành phố Hà Nội)2 . Hoàng Nghĩa Phú đỗ trạng nguyên khoa Tân Mùi, niên hiệu Hồng Thuận thứ 2 (1511), đời Lê Tương Dực2 3 . Ông làm quan đến tham tri chính sự, kiêm Đô ngự sử. Lúc mất, ông được phong làm phúc thần2 . Trạng nguyên Hoàng Nghĩa Phú sinh năm Ất Tỵ (1485). Ngài là con trai trưởng của Tiến sĩ Hoàng Khắc Minh hiệu Thủy Hiên Tiên Sinh (1453-1534) là chắt trưởng của cụ Hoàng Trình Thanh (1411-1463) - Danh nhân đất nước, một trong mười nhà Nho có đức nghiệp lớn của nước ta dưới triều Lê. Ngài sinh ra ở làng Huyền Khê, sau đổi là Đan Sỹ (丹 俟), xã Trung Thanh Oai, tổng Thượng Thanh Oai, huyện Thanh Oai, phủ Ứng Thiên nay là làng Đa Sỹ, phường Kiến Hưng, quận Hà Đông, thành phố Hà Nội. Ngay từ thuở nhỏ, Ngài đã bộc lộ bẩm tính thông minh. Lên 4 tuổi đã đọc kinh truyện chính văn. Lên 10 tuổi nổi tiếng là thần đồng. Năm 16 tuổi Ngài dự thi Hương đỗ đầu, năm 17 tuổi Ngài vào kinh dự thi Hội trúng Tam trường. Vì còn ít tuổi nên Ngài được ở lại Quốc Tử giám học tập tiếp. Năm 20 tuổi Ngài được bổ đi làm Huấn đạo ở huyện Lệ Thủy. Năm Hồng Thuận thứ 3 khoa Tân Mùi (1511), Ngài dự thi đã đỗ Đệ nhất giáp Tiến sĩ cập đệ Đệ nhất danh (tức là Trạng nguyên), năm ấy Ngài 27 tuổi. Năm sau đó Ngài được bổ làm quan Hàn Lâm viện Hiệu lý suốt 23 năm từ 1511 đến 1533. Mãi đến đời vua Lê Trung Tung niên hiệu Nguyên Hòa năm thứ 2 (Giáp Ngọ - 1534) khi sự nghiệp trung hưng của nhà Lê bắt đầu, Ngài đã 50 tuổi được bổ làm Giám sát Ngự sử Binh bộ Tả Thị lang rồi thăng Đông các Đại học sỹ và tiếp tục làm quan đến Tham tri chính trị, Tham tri Chính phủ, dự bàn các công việc của triều đình nhà Lê trong sự nghiệp trung hưng đất nước. Trong hoàn cảnh bắt đầu sự nghiệp trung hưng một mặt phải đánh dẹp nhà Mạc, một mặt phải ổn định xã hội, thu phục lòng dân, Ngài đã đem hết tài năng và trí tuệ của mình phò vua vực nước, như trong cuốc Từ điển nhân vật lịch sử, Nhà xuất bản……., trang 314 đã viết về Ngài: “Trong nước loạn lạc, Ông có công lo việc trị bình”. Với tài học của quan Trạng nguyên, với con người biết liêm biết xỉ của nhà Nho chính trực, Ngài không bao giờ một mình vào triều yết kiến, nhưng rất cung kính ngữ nghiêm phép tắc triều đình, vì vậy nhà vua rất trọng dụng và Ngài được thăng tiến vượt bậc không theo thứ tự. Vua nhà Minh cũng đã từng khen ngợi Ngài là người thông thái. Năm 64 tuổi (1548) Ngài dâng sớ xin lui về nghỉ hưu, phải 3 lần khẩn khoản nhà vua mới chuẩn cho. Ngài trở về sống với quê hương yên bình, với gia đình con cháu. Cũng như cha, ông, cụ nội, Ngài tận tụy với nước, thương mến chúng dân, tuân theo di chúc của cha, Ngài đã tặng hẳn cho nhân dân các làng Mạc Xá, Đồng Hoàng, Đồng Dương, Làng Thị,… thuộc tổng Đồng Dương hàng trăm mẫu ruộng mà triều đình đã ban cho gia đình Ngài làm bổng lộc lương ăn. Những khi mất mùa gia đình Ngài đều cấp phát tiền gạo cứu giúp dân nghèo. Vì vậy chẳng riêng nhân dân mấy làng được nhận ruộng đất mà xa gần đều vô cùng quý mến và biết ơn. Con trai Ngài, Tiến sĩ Hoàng Tế Mỹ (Mạc Đại Chính, khoa Mậu Tuất -1538) đỗ Tiến sĩ, làm quan Quốc Tử giám Tế tửu, tước Trân Khê hầu. "
  },
  {
    "king": "Lê Tương Dực",
    "graduatedYear": "1514",
    "id": "nguyenducluong",
    "name": "Nguyễn Đức Lượng",
    "otherName": "Không rõ",
    "bornYear": 14651,
    "deathYear": 0,
    "parents": [],
    "dynasties": [
      "Thời kỳ thuộc Minh "
    ],
    "home": "Hà Nội",
    "desc": "Nguyễn Đức Lượng (chữ Hán: 阮德亮, 14651 - ?), người xã Canh Hoạch, huyện Thanh Oai, phủ Ứng Thiên, trấn Sơn Nam2 3 (nay thuộc xã Dân Hòa huyện Thanh Oai, thành phố Hà Nội)1 , đỗ đầu khoa tháng tư, Giáp Tuất, Hồng Thuận năm thứ 6 (1514), đời Lê Tương Dực cùng Nguyễn Chiêu Huấn (阮昭訓), Hoàng Minh Tá (黃明佐) là 3 người đỗ đệ nhất giáp tiến sĩ cập đệ; Nguyễn Vũ (阮瑀) cùng 19 người khác đỗ đệ nhị giáp tiến sĩ xuất thân; Nguyễn Bỉnh Di (阮秉彝) và 19 người khác đỗ đệ tam giáp đồng tiến sĩ xuất thân. Ngày 27 tháng 4, vua thân hành ngự điện ra đầu bài văn sách hỏi về nhân tài. Sai Tả bình chương quân quốc trọng sự nhập nội kiểm hiệu thượng tướng thái uý Lương quốc công Lê Phụ, Lại bộ thượng thư tri Chiêu Văn quán Tú lâm cục Đàm Thận Huy, Công bộ hữu thị lang Lê Tán Tương, Thiếu bảo Lại bộ thượng thư Do Lễ bá Nguyễn Bá Thuyên, Hộ bộ thượng thư tri Chiêu Văn quán Tú lâm cục Cẩn Lễ nam Đoàn Mậu, Thiếu báo Lễ bộ thượng thư Đông các đại học sĩ kiêm Quốc tử giám tế tửu tri kinh diên sự Đôn Thư bá Lê Tung, Hình bộ thượng thư Đông các đại học sĩ nhập thị kinh diên Đỗ Nhạc chia nhau trông coi việc thi2 . Nguyễn Đức Lượng từng đi sứ nhà Minh3 . Ông làm quan Tả Thị lang Bộ Lễ1 . Khi ông chết, được tặng thượng thư1 3 . (Nguồn: Wikipedia) "
  },
  {
    "king": "Lê Chiêu Tông",
    "graduatedYear": "1518",
    "id": "ngomienthieu",
    "name": "Ngô Miễn Thiệu",
    "otherName": "Không rõ",
    "bornYear": 14992,
    "deathYear": 0,
    "parents": [],
    "dynasties": [
      "nhà Mạc"
    ],
    "home": "Bắc Ninh",
    "desc": "Ngô Miễn Thiệu (chữ Hán: 吳勉紹, 14981 hay 14992 - ?), người xã Tam Sơn, huyện Đông Ngàn, phủ Từ Sơn, Kinh Bắc (nay thuộc xã Tam Sơn, huyện Từ Sơn, Bắc Ninh). Ông đỗ trạng nguyên khoa Mậu Dần, niên hiệu Quang Thiệu thứ 3 (1518) đời Lê Chiêu Tông1 2 3 . Ông giữ các chức quan như Thượng thư Bộ Lại kiêm Đô ngự sử, Chưởng Hàn lâm viện sự, Nhập thị Kinh diên và tước Lý Khê bá2 . Sau ông làm quan với nhà Mạc, giữ các chức quan như Thượng thư Bộ Lễ, Đông các Đại học sĩ, Ngự sử đài Đô Ngự sử, Hàn lâm viện Thị thư và thăng Trình Khê hầu2 . (Nguồn: Wikipedia) "
  },
  {
    "king": "Lê Cung Hoàng",
    "graduatedYear": "1523",
    "id": "hoangvantan",
    "name": "Hoàng Văn Tán",
    "otherName": "Không rõ",
    "bornYear": 0,
    "deathYear": 0,
    "parents": [],
    "dynasties": [],
    "home": "Bắc Ninh",
    "desc": "Hoàng Văn Tán (chữ Hán: 黃文贊, ? - ?) người xã Xuân Lôi, huyện Vũ Ninh (nay thuộc xã Đại Xuân huyện Quế Võ, tỉnh Bắc Ninh)1 . Ông thi đỗ trạng nguyên năm 1523, trong khoa thi Quý Mùi, niên hiệu Thống Nguyên thứ hai của vua Lê Cung Đế2 3 . Ông được giao cùng với Đông các đại học sĩ Đạo Nguyện bá Nguyễn Văn Thái thảo tờ chiếu của Lê Cung Hoàng nhường ngôi cho Mạc Đăng Dung1 (Đại Việt Sử ký Toàn thư chỉ chép là Nguyễn Văn Thái thảo chiếu này2 ). Sau đó, ông làm quan nhà Mạc đến chức Tả Thị lang Bộ Lễ1 . (Nguồn: Wikipedia) "
  },
  {
    "king": "Lê Cung Hoàng",
    "graduatedYear": "1526",
    "id": "trantatvan",
    "name": "Trần Tất Văn",
    "otherName": "Không rõ",
    "bornYear": 1428,
    "deathYear": 1527,
    "parents": [],
    "dynasties": [
      "nhà Mạc"
    ],
    "home": "Hải Phòng",
    "desc": "Trần Tất Văn (chữ Hán: 陳必聞, 1428-15271 ), người xã Nguyệt Áng, huyện An Lão, phủ Kinh Môn, Hải Dương2 3 (nay thuộc quận Kiến An, thành phố Hải Phòng), đỗ đầu đệ nhất giáp tiến sĩ cập đệ (Trạng nguyên) khoa tháng tư, Bính Tuất, Thống Nguyên năm thứ 5 (1526), đời Lê Cung Hoàng cùng Nguyễn Văn Du, Lưu Trung Doãn 3 người đỗ đệ nhất giáp tiến sĩ cập đệ; bọn Lê Quang Bí 4 người đỗ đệ nhị giáp tiến sĩ xuất thân; bọn Phạm Đình Quang 13 người đỗ đệ tam giáp đồng tiến sĩ xuất thân2 . Trần Tất Văn sau ra làm quan cho nhà Mạc tới thượng thư, tước Hàn Xuyên bá2 . Từng đi sứ nhà Minh3 .   Trạng nguyên Trần Tất Văn sinh ra trong một gia đình họ Trần - dòng dõi nhà nho ở thời hậu Lê (1428-1527) tại làng Nguyệt Áng xã Thái Sơn huyện An Lão, thành phố Hải Phòng. Do xuất thân là dòng dõi quý tộc, được thừa hưởng tư chất thông minh và được học hành đầy đủ nên ngay từ nhỏ Trần Tất Văn đã nổi tiếng về hiếu học, chăm ngoan. Qua nhiều năm miệt mài đèn sách ông đã vượt qua kỳ thi Hương (đỗ Giải nguyên), thi Hội (đỗ Hội nguyên), thi Đình (đỗ Trạng nguyên) - học vị cao nhất tại kỳ thi năm Bính Tuất niên hiệu Thống nguyên (1526) đời Lê Cung Hoàng. Ông là Trạng nguyên duy nhất của huyện An Lão dưới thời phong kiến, đồng thời đứng thứ 30 trong tổng số 47 Trạng nguyên của cả nước. Ngày Trần Tất Văn được vua ban cờ, biển cho về lễ tạ tổ tiên và các thầy học cũ, dân làng nô nức đón rước người ham học, đỗ cao, làm vẻ vang cho quê hương, dòng họ. Sau đỗ đạt, ông làm quan cho triều Mạc, đến chức Thượng thư, tước hàm xuyên bá. Dưới thời Mạc Đăng Dung, Mạc Đăng Doanh, ông được giao trông coi việc từ hàn, những văn thư trao đổi giữa nhà Minh, nhà Mạc ông đều tham gia. Đã có lần ông được vua Mạc cử đi sứ nhà Minh, dùng ngoại giao để đấu tranh bảo vệ chủ quyền đất nước. Bằng lý luận đanh thép và lập luận chặt chẽ - bài Biểu của ông đã làm Mao Bá Ôn - tướng nhà Minh đang tập hợp đại quân ở biên giới chuẩn bị xâm chiếm nước ta khi đọc bài biểu đã rỏ nước mắt rồi quyết định rút quân. Phát huy truyền thống gia đình, 39 năm sau con trai Trạng nguyên Trần Tất Văn là Trần Tảo đã đỗ Tiến sĩ làm quan đến chức Thừa chính sứ. Cùng với cha, tiến sĩ Trần Tảo đã góp nhiều công lớn trong sự nghiệp giữ gìn bờ cõi và phát triển đất nước. "
  },
  {
    "king": "Mạc Thái Tổ",
    "graduatedYear": "1529",
    "id": "dotong",
    "name": "Đỗ Tống",
    "otherName": "Không rõ",
    "bornYear": 15041,
    "deathYear": 0,
    "parents": [],
    "dynasties": [
      "nhà Mạc"
    ],
    "home": "Hưng Yên",
    "desc": "Đỗ Tống (chữ Hán: 杜綜, 15041 - ?), người xã Lại Ốc, huyện Tế Giang, phủ Thuận An, Kinh Bắc (nay thuộc xã Long Hưng, huyện Văn Giang, tỉnh Hưng Yên)1 . Ông đỗ trạng nguyên khoa Kỷ Sửu, niên hiệu Minh Đức thứ 3 (1529) đời Mạc Thái Tổ1 2 3 . Ông làm quan cho nhà Mạc, giữ các chức quan như như Tả Thị lang Bộ Hình, Đông các Đại học sĩ1 . (Nguồn: Wikipedia) "
  },
  {
    "king": "Mạc Thái Tông",
    "graduatedYear": "1535",
    "id": "nguyenbinhkhiemnguyenvandat",
    "name": "Nguyễn Bỉnh Khiêm",
    "otherName": "Nguyễn Văn Đạt",
    "bornYear": 1491,
    "deathYear": 1585,
    "parents": [],
    "dynasties": [
      "nhà Mạc",
      "Nam Bắc Triều"
    ],
    "home": "Hải Phòng",
    "desc": "Nguyễn Bỉnh Khiêm (chữ Hán: 阮秉謙; 1491–1585), tên huý là Nguyễn Văn Đạt (阮文達)1 , tên tự là Hanh Phủ (亨甫), hiệu là Bạch Vân am cư sĩ (白雲庵居士)2 , được các môn sinh tôn là Tuyết Giang phu tử (雪江夫子), là một trong những nhân vật có ảnh hưởng nhất của lịch sử cũng như văn hóa Việt Nam trong thế kỷ 16. Ông được biết đến nhiều vì tư cách đạo đức, tài thơ văn của một nhà giáo có tiếng thời kỳ Nam-Bắc triều (Lê-Mạc phân tranh) cũng như tài tiên tri các tiến triển của lịch sử Việt Nam. Sau khi đậu Trạng nguyên khoa thi Ất Mùi (1535)3 và làm quan dưới triều Mạc, ông được phong tước Trình Tuyền Hầu rồi thăng tới Trình Quốc Công (程國公)4 5 mà dân gian quen gọi ông là Trạng Trình.6 Đạo Cao Đài sau này đã phong thánh cho ông và suy tôn ông là Thanh Sơn Đạo sĩ hay Thanh Sơn chân nhân. Người đời coi ông là nhà tiên tri số một trong lịch sử Việt Nam đồng thời lưu truyền nhiều câu sấm ký được cho là bắt nguồn từ ông và gọi chung là Sấm Trạng Trình. Xét một cách toàn diện lịch sử Việt Nam thế kỷ 16, nhiều người đã gọi Nguyễn Bỉnh Khiêm là \"cây đại thụ văn hóa dân tộc\", hay nói theo cách khác, ông đã được xem là đại diện tiêu biểu nhất của lịch sử phát triển văn hóa Việt Nam trong thế kỷ nhiều biến động lớn này.7 8 Cùng với một nhân vật nổi danh khác của xứ Hải Đông là Nguyễn Trãi, Nguyễn Bỉnh Khiêm được coi là một trong số những tác gia văn học thực sự lớn đầu tiên của Việt Nam. Đó là những người mà tác phẩm của họ có sự dồi dào về số lượng, phong phú về thể tài và có ảnh hưởng quan trọng đến tiến trình phát triển của một nền văn học, đặc biệt là trong văn học viết. Một yếu tố quan trọng nữa ở các tác gia này là phần lớn tác phẩm của họ vẫn còn được lưu truyền qua nhiều biến động của lịch sử để hậu thế ngày nay có thể nghiên cứu và đánh giá một cách tương đối toàn diện về sự nghiệp văn chương của họ. Nguyễn Bỉnh Khiêm được nhiều nhà nghiên cứu văn học Việt Nam đánh giá là người xứng đáng kế thừa và phát triển ngôn ngữ thi ca dân tộc kể từ sau thời Nguyễn Trãi,9 10 11 góp phần giúp nó đạt đến mức độ hoàn thiện cao dưới thời Nguyễn Du. Hai tập thơ của ông là Bạch Vân am thi tập (chữ Hán) và Bạch Vân quốc ngữ thi tập (chữ Nôm) được coi là thành tựu lớn của thơ văn trung đại Việt Nam, mở đầu cho một dòng thơ ca \"chạm chân vào hiện thực\", đã quan tâm mô tả xã hội dưới góc nhìn đời tư và đời thường, là một cống hiến lớn của văn học thời Mạc đối với tiến trình phát triển và hoàn thiện của thơ văn dân tộc.12 13 14 Xét về nhiều mặt, có thể xem ông là người đi khai phá có công khơi mở nhiều hướng phát triển mới cho thơ ca Việt Nam, trong đó có những dòng thơ mang đậm tính tuyên truyền đạo lý - suy tưởng triết lý - cảm hứng thế sự (tiệm cận với hiện thực đa diện của xã hội đương thời) sẽ có điều kiện phát triển mạnh ở các thế kỷ sau ông như lịch sử thơ văn Việt Nam đã ghi nhận. Ngoại trừ quãng thời gian dưới 10 năm thời thơ ấu có thể xem là bình yên cuối triều Lê Thánh Tông, Nguyễn Bỉnh Khiêm đã sống gần trọn thế kỷ 16, một thế kỷ nhiều biến chuyển mang tầm ảnh hưởng chưa từng có trước đó trong lịch sử dân tộc, mà ông vừa là nhân chứng vừa là nhân tố quan trọng tạo nên chúng. Là một người xuất thân từ tầng lớp trí thức quan lại nhưng cả cuộc đời Nguyễn Bỉnh Khiêm chưa bao giờ coi việc làm quan là lý tưởng cao nhất của sự nghiệp, cũng như là một nhà nhân đạo chủ nghĩa ông luôn đề cao tư tưởng thân dân trong sách lược trị nước. Ông cũng được sử sách và người đời thừa nhận rộng rãi với tư cách là một nhà dự báo, hoạch định chiến lược kỳ tài,15 16 với tầm nhìn địa chính trị đi trước thời đại nhiều thế kỷ.17 18 19 Những lời cố vấn nổi tiếng của ông dành cho các tập đoàn quyền lực phong kiến Mạc, Lê-Trịnh, Nguyễn (nói theo lời của danh sĩ Nguyễn Thiếp là phiến ngữ toàn tam tính)20 đã có ảnh hưởng to lớn, mang tính bước ngoặt đối với tiến trình của lịch sử dân tộc và từ đó tác động lớn tới quan hệ địa chính trị của cả khu vực Đông Nam Á trở về sau. Theo nhận định của nhiều nhà nghiên cứu, Nguyễn Bỉnh Khiêm có khả năng là người đầu tiên trong lịch sử Việt Nam có một tầm nhìn chiến lược thấu suốt về chủ quyền của đất nước trên biển Đông ngay từ thế kỷ 16.21 22 Ông cũng có thể là người đầu tiên trong lịch sử nhắc đến hai chữ Việt Nam – với tư cách là quốc hiệu của dân tộc – một cách có ý thức nhất thông qua di sản thơ văn của ông còn lưu lại đến ngày nay.23 24   "
  },
  {
    "king": "Mạc Tuyên Tông",
    "graduatedYear": "1547",
    "id": "duongphuctu",
    "name": "Dương Phúc Tư",
    "otherName": "Không rõ",
    "bornYear": 0,
    "deathYear": 1563,
    "parents": [],
    "dynasties": [],
    "home": "Hưng Yên",
    "desc": "Dương Phúc Tư (chữ Hán: 楊福滋, 1505–1564), người làng Lạc Đạo, huyện Gia Lâm, phủ Thuận An, trấn Kinh Bắc (nay thuộc huyện Văn Lâm, Hưng Yên). Đỗ trạng nguyên khoa Đinh Mùi, niên hiệu Vĩnh Định thứ nhất (1547), đời Mạc Tuyên Tông (Mạc Phúc Nguyên). Ông làm chức quan tham chính. Sau này ông dâng sớ xin quy thuận Lê Thế Tông rồi đi ở ẩn. Trạng nguyên Dương Phúc Tư (1505 – 1563), là người khai khoa cho dòng họ Dương, xã Lạc Đạo (Văn Lâm). Thuở hàn vi, Dương Phúc Tư vừa đi cày vừa đi học. Sẵn có tư chất thông minh, lại ngày đêm đèn sách, với sự quan tâm dạy dỗ chu đáo của người cha, người thầy mẫu mực là cụ Giảng Dụ Nghĩa Yêm, Dương Phúc Tư đã đạt đến đỉnh cao của nền học vấn thời cổ. Năm 43 tuổi, Dương Phúc Tư đỗ đệ nhất giáp Tiến sĩ cập đệ, đệ nhất danh, tức Trạng nguyên, đứng đầu 30 Tiến sĩ đời Mạc Phúc Nguyên. Bài văn sách thi Đình của Dương Phúc Tư được vua phê rằng: “Điều đối thiết yếu, chân đại thủ bút, sĩ vị chân nho, xuất thế đạo hành” (Có thể hiểu là: Điều đối thật là thiết yếu, đây là cây bút lớn, là vị chân nho, xuất thế đạo hành). Trạng nguyên Dương Phúc Tư từng làm quan đến chức Binh bộ Thượng thư, được vua phong Tử Khanh Thiếu Bảo, Dương tướng công.Về sau Dương Phúc Tư từ quan đi dạy học ở Cổ Thiết, Sơn Tây. Là bậc chân nho văn võ kiêm toàn, một thầy dạy học lỗi lạc, học trò của Trạng nguyên Dương Phúc Tư có nhiều người đỗ Cử nhân, Tiến sĩ. Trong đó có ông Phạm Trấn, người xã Lam Cầu, huyện Gia Lộc (Hải Dương) đỗ Trạng nguyên, khoa thi năm Bính Thìn (1556). Sau này, Trạng nguyên Dương Phúc Tư về quê hương sinh sống và mất năm 1563 hưởng thọ 59 tuổi. Mộ cụ Trạng được táng tại gò Mả Cả, thôn Ngọc, xã Lạc Đạo. Di văn của cụ còn lại một bài văn đình đối và tập thơ “Độc sử thi phả” hiện được lưu giữ tại Viện Nghiên cứu Hán Nôm. Đời sau con cháu tôn Trạng nguyên Dương Phúc Tư là Thủy Tổ của họ Dương ở xã Lạc Đạo. Kế thừa đạo học của Trạng nguyên Dương Phúc Tư, họ Dương đã sinh thành những bậc quý hiển danh gia, làm nên sự nghiệp vẻ vang, mang tiếng thơm về cho dòng họ. Từ thế kỷ thứ 16 đến hết thế kỷ 18 là thời kỳ họ Dương ở xã Lạc Đạo rất thịnh vượng về khoa cử. Tính từ năm 1547 – 1754, họ Dương ở xã Lạc Đạo có 9 người đỗ đại khoa trong đó có 1 Trạng nguyên và 8 Tiến sỹ bao gồm: Dương Phúc Tư, Dương Thuần, Dương Hoàng, Dương Khuông, Dương Hạo, Dương Lệ, Dương Công Thụ, Dương Khiêm, Dương Sử. Ngay sau khi Trạng nguyên Dương Phúc Tư qua đời, con cháu và nhân dân sở tại dựng nhà thờ cụ trên nền đất của dòng họ. Nhà thờ cụ Trạng được xây dựng từ thời Lê và đã trải qua nhiều lần tu sửa vào thời Nguyễn. Nhà thờ đã được UBND tỉnh Hưng Yên cấp Bằng công nhận Di tích lịch sử văn hóa cấp tỉnh. Hiện tại nhà thờ vẫn giữ được nét kiến trúc Lê – Nguyễn đan xen và giữ được nhiều hiện vật có giá trị lịch sử như hoành phi, câu đối, các đồ thờ, các sắc phong, gia phả, bia đá, câu đối tưởng nhớ và ca ngợi công đức và sự nghiệp của Dương Phúc Tư. Ngoài ra còn có khu lăng mộ và nhà bia tưởng niệm tại gò Mả Cả, thôn Ngọc, xã Lạc Đạo. Gần đây, con cháu và dòng họ Dương ở xã Lạc Đạo đã xây dựng lại mộ phần Trạng nguyên Dương Phúc Tư to đẹp và tôn nghiêm. Tưởng nhớ và biết ơn công lao Trạng nguyên Dương Phúc Tư, năm 2002, huyện Văn Lâm đã quyết định đặt tên ngôi trường chất lượng cao của huyện là Trường THCS Dương Phúc Tư. Ngày nay, dòng họ Dương là một trong những dòng họ lớn ở xã Lạc Đạo với trên 3.000 nhân khẩu, chiếm khoảng ¼ dân số của xã. Trưởng tộc dòng họ Dương xã Lạc Đạo cho biết: “Khuyến học, khuyến tài luôn là nhiệm vụ trọng tâm của dòng tộc. Mỗi năm, dòng họ Dương Lạc Đạo có khoảng 40 cháu đỗ Đại học và 50 – 70 cháu đạt danh hiệu Học sinh giỏi. Hàng năm dòng họ tổ chức họp, giỗ Tổ vào ngày Rằm tháng Giêng và trao thưởng cho con cháu đỗ đạt. Các buổi vinh danh, khen thưởng các cháu học sinh có thành tích cao trong học tập trở thành ngày hội của dòng họ, để con cháu đời sau thêm tự hào và viết tiếp truyền thống khoa bảng của tổ tiên”. Hiện nay tại huyện Văn Lâm - Hưng Yên đã thành lập trường THCS chất lượng cao Dương Phúc Tư để tưởng nhớ tới công lao của ông. (Nguồn: Wikipedia) "
  },
  {
    "king": "Mạc Tuyên Tông",
    "graduatedYear": "1550",
    "id": "tranvanbao",
    "name": "Trần Văn Bảo",
    "otherName": "Không rõ",
    "bornYear": 1524,
    "deathYear": 1611,
    "parents": [],
    "dynasties": [
      "Nhà Tiền Lê",
      "Nhà Hậu Lê",
      "nhà Lê Sơ",
      "nhà Lê Trung Hưng"
    ],
    "home": "Nam Định",
    "desc": "Trần Văn Bảo (chữ Hán: 陳文寶, 1524 - 1611) là một danh sĩ Việt Nam. Ông từng đỗ Trạng nguyên khoa Canh Tuất, niên hiệu Cảnh Lịch thứ 3 (1550), đời Mạc Tuyên Tông, làm quan đến chức Thượng thư, từng đi sứ phương Bắc, được phong tước Nghĩa quận công.   Nguyên quán ông gốc làng Đại Bối, huyện Đông Sơn, tỉnh Thanh Hóa, trước thuộc dòng dõi họ Lê. Thân sinh ông là Lê Minh Triết, húy Văn Linh, tự Minh Đạt, làm quan triều nhà Lê tước Hán Quận Công, lấy bà Trần Thị Từ Huệ người làng Cổ Chử, sinh ra ông. Nguyên tên ông là Lê Minh Bảo, sinh giờ Dần ngày 7 tháng 1 năm Giáp Thân (tức 10 tháng 2 năm 1524) tại làng Cổ Chử, huyện Giao Thủy, phủ Thiên Trường, trấn Sơn Nam (nay thuộc xã Hồng Quang, huyện Nam Trực, tỉnh Nam Định). Ông đỗ Trạng nguyên khoa Canh Tuất (1550) niên hiệu Cảnh Lịch thứ 3, đời Mạc Phúc Nguyên, thi đỗ khi 27 tuổi. Ông giữ các chức như: Lại Bộ Thượng thư, Nhập Thị Kinh Diên; đi sứ Trung Quốc đời Minh Thế Tông. Ông được phong tước Nghĩa Sơn Bá, Hồng Xuyên Hầu, Nghĩa Quận Công. Sau ba lần dâng sớ xin vua Mạc cải cách chính sự, nhà vua chấp thuận nhưng không thi hành, ông xin từ quan về trí sĩ, năm đó ông 63 tuổi. "
  },
  {
    "king": "Mạc Tuyên Tông",
    "graduatedYear": "1553",
    "id": "nguyenluongthai",
    "name": "Nguyễn Lượng Thái",
    "otherName": "Không rõ",
    "bornYear": 1525,
    "deathYear": 1576,
    "parents": [],
    "dynasties": [],
    "home": "Bắc Ninh",
    "desc": "Nguyễn Lượng Thái (chữ Hán: 阮亮采, 1525 - 1576), người xã Bình Ngô, huyện Gia Định1 , phủ Thuận An, trấn Kinh Bắc2 (nay thuộc xã An Bình, huyện Thuận Thành, tỉnh Bắc Ninh)1 . Trú quán xã Trạm Lộ1 (cùng huyện). Ông đỗ đệ nhất giáp đồng tiến sĩ cập đệ đệ nhất danh (trạng nguyên), khoa Quý Sửu niên hiệu Cảnh Lịch thứ 6 (1553)3 đời Mạc Tuyên Tông (Mạc Phúc Nguyên). Ông làm quan Tả Thị lang Bộ Lễ, kiêm Đông các Đại học sĩ2 , tước Định Nham hầu1 . (Nguồn: Wikipedia) "
  },
  {
    "king": "Mạc Tuyên Tông",
    "graduatedYear": "1559",
    "id": "dangthitho",
    "name": "Đặng Thì Thố",
    "otherName": "Không rõ",
    "bornYear": 0,
    "deathYear": 0,
    "parents": [],
    "dynasties": [],
    "home": "Hải Dương",
    "desc": "Đặng Thì Thố (chữ Hán: 鄧時措, 1526 – ?) là trạng nguyên1 thứ 40 của Việt Nam. Ông là hậu duệ của Quốc công Đặng Tất, quê làng An Lạc (còn gọi là làng Thạc), huyện Thanh Lâm (nay thuộc xã An Châu, thành phố Hải Dương)1 . Hiện nay, ở các xã An Châu, Nam Trung và Nam Chính (Nam Sách) vẫn còn gia phả ghi về cụ Tổ Đặng Thì Thố - giỗ ngày 12 tháng 10 âm lịch. Ông đỗ tiến sĩ cập đệ khoa Kỉ Mùi năm Quang Bảo thứ 6 (1559) dưới thời vua Mạc Tuyên Tông2 , tuy nhiên theo bảng tra các vị tam khôi của Viện Hán-Nôm thì ông chỉ đỗ thám hoa (tiến sĩ cập đệ đệ nhất giáp đệ tam danh)3 . Lịch triều hiến chương loại chí của Phan Huy Chú cũng chép rằng ông là Hội nguyên Đình nguyên Thám hoa4 . Sau đó, ông trở thành quan của triều đình nhà Mạc, làm đến chức tả thị lang bộ Binh[cần dẫn nguồn], hàn lâm viện. Mộ của ông táng tại An Lạc, được con cháu trùng tu năm 2005[cần dẫn nguồn]. Con trai ông là Đặng Thì Mẫn (1549 - ?) cũng đỗ đệ tam giáp đồng tiến sĩ xuất thân khoa thi năm Hoằng Định thứ 14 (Quý Sửu, 1613)5 thời Lê Kính Tông. (Nguồn: Wikipedia) "
  },
  {
    "king": "Mạc Mậu Hợp",
    "graduatedYear": "1562",
    "id": "phamduyquyetphamduyquyet",
    "name": "Phạm Duy Quyết",
    "otherName": "Phạm Duy Quyết",
    "bornYear": 1521,
    "deathYear": 0,
    "parents": [],
    "dynasties": [],
    "home": "Hải Dương",
    "desc": "Phạm Đăng Quyết (1521 - ?), tên lúc nhỏ là Phạm Duy Quyết (chữ Hán: 范維玦), người làng Xác Khê, huyện Chí Linh, phủ Nam Sách, Hải Dương. Ông còn có tên khác là Phạm Duy Áng, có sách chép là Phạm Duy Ưởng hay Phạm Duy Trĩ. Đỗ trạng nguyên khoa Nhâm Tuất, niên hiệu Thuần Phúc thứ nhất (1562), đời Mạc Mậu Hợp. Làm quan đến Tả thị lang kiêm Đông các Đại học sĩ, tước Xác Khê Hầu. (Nguồn: Wikipedia) "
  },
  {
    "king": "Mạc Mậu Hợp",
    "graduatedYear": "1565",
    "id": "phamquangtien",
    "name": "Phạm Quang Tiến",
    "otherName": "Không rõ",
    "bornYear": 1530,
    "deathYear": 0,
    "parents": [],
    "dynasties": [
      "Thời kỳ thuộc Minh "
    ],
    "home": "Bắc Ninh",
    "desc": "Phạm Quang Tiến (chữ Hán: 范光進, 1530-?) Người làng Lương Xá, huyện Thiện Tài, trấn Kinh Bắc (nay thuộc xã Phú Lương, huyện Lương Tài, tỉnh Bắc Ninh)1 . Đỗ Trạng nguyên khoa Ất Sửu, niên hiệu Thuần Phúc thứ 4 (1565) thời Mạc Mậu Hợp2 . Ông làm quan Đông các Đại học sĩ, được cử đi sứ sang nhà Minh (Trung Quốc) và mất trên đường đi. Sau khi mất, ông được truy tặng chức Tả Thị lang1 . Cùng quê với ông còn có Vũ Giới cũng đỗ trạng nguyên của nhà Mạc, nhưng sau ông 12 năm. (Nguồn: Wikipedia) "
  },
  {
    "king": "Mạc Mậu Hợp",
    "graduatedYear": "1577",
    "id": "vugioi",
    "name": "Vũ Giới",
    "otherName": "Không rõ",
    "bornYear": 1541,
    "deathYear": 1593,
    "parents": [
      "Hoàng Sĩ Khải"
    ],
    "dynasties": [],
    "home": "Bắc Ninh",
    "desc": "Vũ Giới (chữ Hán: 武玠, 1541-1593), người xã Lương Xá, huyện Thiện Tài, trấn Kinh Bắc (nay là thôn Lương Xá, xã Phú Lương, huyện Lương Tài, Bắc Ninh)1 , cùng làng với Phạm Quang Tiến, trạng nguyên khoa thi 1565. Đỗ trạng nguyên khoa Đinh Sửu, niên hiệu Sùng Khang thứ 12 (1577) đời Mạc Mậu Hợp2 3 . Làm quan qua các chức như Hữu thị lang, Thượng thư Lại bộ2 . Thân phụ ông là Vũ Kính, từng đỗ Đình nguyên hoàng giáp. Vợ Vũ Giới là con của Hoàng Sĩ Khải. Hoàng Sĩ Khải tên hiệu là Lãn Trai, quê Lai Xá (Lương Tài, Bắc Ninh) đỗ tiến sĩ khoa thi Giáp Thìn thời vua Mạc Phúc Hải (1544), làm quan đến chức Hộ bộ thượng thư kiêm Quốc Tử Giám tế tửu. Hoàng Sĩ Khải và Vũ Kính là bạn đồng khoa.1 (Nguồn: Wikipedia) "
  },
  {
    "king": "Lê Thần Tông",
    "graduatedYear": "1637",
    "id": "nguyenxuanchinh",
    "name": "Nguyễn Xuân Chính",
    "otherName": "Không rõ",
    "bornYear": 1587,
    "deathYear": 1693,
    "parents": [],
    "dynasties": [],
    "home": "Bắc Ninh",
    "desc": "Nguyễn Xuân Chính (chữ Hán: 阮春正, 1587 - 1693) người làng Phù Chẩn, huyện Đông Ngàn, phủ Từ Sơn, Kinh Bắc (nay là xã Phù Chẩn, thị xã Từ Sơn, tỉnh Bắc Ninh). Đỗ trạng nguyên khoa Đinh Sửu, niên hiệu Dương Hòa thứ 3 (1637), đời Lê Thần Tông1 khi đó ông đã 50 tuổi, là trạng nguyên già nhất trong lịch sử. Làm quan đến Tả thị lang Lại bộ, Nhập thị Kinh diên, tước Đạo Ngạn bá. Sau khi mất, ông được tặng chức Thượng thư, tước hầu. Có tài liệu ghi ông là Nguyễn Xuân Sinh2 . (Nguồn: Wikipedia) "
  },
  {
    "king": "Lê Thần Tông",
    "graduatedYear": "1661",
    "id": "dangcongchat",
    "name": "Đặng Công Chất",
    "otherName": "Không rõ",
    "bornYear": 16222,
    "deathYear": 1683,
    "parents": [],
    "dynasties": [],
    "home": "Hà Nội",
    "desc": "Đặng Công Chất (chữ Hán: 鄧公質, 16211 hay 16222 - 1683), người làng Phù Đổng, huyện Tiên Du, phủ Từ Sơn, trấn Kinh Bắc (nay thuộc xã Phù Đổng, huyện Gia Lâm, Hà Nội). Nguyên quán của ông là xã Thái Bát, huyện Bất Bạt (nay thuộc xã Tòng Bạt, huyện Ba Vì, thành phố Hà Nội)2 . Đỗ trạng nguyên khoa Tân Sửu, niên hiệu Vĩnh Thọ thứ 4 (1661) thời vua Lê Thần Tông2 3 . Tháng 3 âm lịch năm Cảnh Trị thứ 3, Ất Tỵ 1665, đời vua Lê Huyền Tông, ông khi đó đang là Hàn lâm viện thị giảng được thăng làm Công bộ hữu thị lang4 . Năm 1670 ông khi đó đang làm Lại bộ hữu thị lang4 đã cùng Lễ bộ tả thị lang Nguyễn Quốc Khôi vào hầu kinh điện. Tháng 9 âm lịch năm 1671 ông cùng Binh bộ tả thị lang Lê Sĩ Triệt khảo xét các nha môn trong ngoài. Tháng 7 âm lịch năm Vĩnh Trị thứ nhất (Bính Thìn, 1676), sau khi Lê Hy Tông lên ngôi ông được phong làm Lại bộ tả thị lang4 . Tháng 8 năm 1677, Đinh Văn Tả đem quân đánh phá được Mạc Kính Vũ ở Cao Bằng, Kính Vũ chạy sang Long Châu, đồ đảng còn lại đều tan vỡ. Sau triều đình nhà Lê cho triệu Đinh Văn Tả về, dùng Đặng Công Chất thay thế và để Tuấn Hòa ở lại giữ chức tham trấn. Tuy nhiên, trong thời gian trấn thủ Cao Bằng, ông bị nha lại và dân chúng tố cáo, phải triệu về triều, triều đình bổ Lê Hải lên thay5 . Tháng giêng năm Chính Hòa thứ 3 (Nhâm Tuất, 1682) Thân Toàn và ông sang nhà Thanh dâng lễ tuế cống, nhân tiện cáo phó về việc Lê Huyền Tông mất và xin phong tước5 . Các tài liệu khác còn ghi: (Nguồn: Wikipedia) "
  },
  {
    "king": "Lê Hy Tông",
    "graduatedYear": "1683",
    "id": "nguyendangdaotrangbiu",
    "name": "Nguyễn Đăng Đạo",
    "otherName": "Trạng Bịu",
    "bornYear": 1651,
    "deathYear": 0,
    "parents": [],
    "dynasties": [
      "Nhà Tiền Lê",
      "Nhà Hậu Lê",
      "nhà Lê Sơ",
      "nhà Lê Trung Hưng"
    ],
    "home": "Bắc Ninh",
    "desc": "Nguyễn Đăng Đạo (chữ Hán: 阮登道, 1651–1719) là một trong số rất ít trạng nguyên làm quan tới chức tể tướng thời Lê trung hưng. Ông còn có tên là Trạng Bịu.   Ông sinh năm 1651, người xã Hoài Bão (có tục danh là làng Bịu), tổng Nội Duệ (nay là xã Liên Bão, huyện Tiên Du, tỉnh Bắc Ninh). Thân phụ ông là tiến sĩ Nguyễn Đăng Minh, giữ chức Quốc tử giám tế tửu trong triều Lê. Ông còn là cháu ruột của thám hoa Nguyễn Đăng Cảo, em trai Nguyễn Đăng Tuân. Ngay từ nhỏ ông đã nổi tiếng thông minh, hoạt bát. Năm 16 tuổi Nguyễn Đăng Đạo đi thi và đỗ tam trường (tú tài). Năm 19 tuổi lại đỗ đầu hương cống (cử nhân), được triều đình cho vào học tại Quốc Tử Giám. Năm Chính Hòa thứ 4 (Quý Hợi, 1683) ông thi đình và đỗ trạng nguyên. Sau khi đỗ trạng, ông được triều đình giao cho giữ nhiều chức vụ quan trọng từ Đô đài ngự sử, Binh bộ Thượng thư rồi lên chức quan cao nhất là Tể tướng đời nhà Hậu Lê. "
  }
]